{
  "schema": "cogeval.cog_case_group.v1",
  "group_id": "group_1",
  "slug": "backend-debugging",
  "name": "Backend Debugging",
  "description": "Published backend debugging cases.",
  "theme_tags": [
    "backend"
  ],
  "status": "published",
  "visibility": "public",
  "selection_mode": "manual",
  "selection_filters": {},
  "member_count": 1,
  "members": [
    {
      "schema": "cogeval.cog_case.v1",
      "test_case_id": "tc_1",
      "cog_case_display_id": "SWE#1",
      "source_id": "swe_bench_pro",
      "external_id": "django__django-1",
      "title": "Fix queryset regression",
      "original_url": "https://example.test/cases/1",
      "labels": {},
      "semantic_profile": {},
      "semantic_version": "2026-06-25",
      "interpretation": "Representative backend debugging task.",
      "online_at": "2026-06-25T00:00:00Z",
      "promoted_at": "2026-06-20T00:00:00Z"
    }
  ],
  "created_at": "2026-06-25T00:00:00Z",
  "updated_at": "2026-06-25T00:00:00Z"
}
